{
  "name": "Lunar Prospector",
  "vehicle": "Athena II",
  "payload": "건조 질량 296 kg; 과학 장비 5종 탑재",
  "delta_v": "~4 km/s (달 전이 궤도 진입 + 달 궤도 진입)",
  "type": "로봇 궤도선 · 비행 완료",
  "first": "달의 양 극점에서 중성자 분광계를 이용한 수소 발견",
  "description": "NASA Discovery급 세 번째 임무이자 Apollo 이후 시대에 NASA가 관리한 최초의 전용 달 궤도선. 1998년 1월 7일 케이프 커내버럴에서 Athena II로 발사된 Lunar Prospector는 1998년 1월 11일 달의 100 km 원형 극궤도에 진입했다. 296 kg의 자전하는 우주선은 다섯 가지 기기를 실었다: 지각 전체 조성을 위한 감마선 분광계, 극지방의 수소/물얼음 탐지를 위한 중성자 분광계, 라돈 가스(간접적인 화산 활동 탐지)를 위한 알파 입자 분광계, 지각 자기장을 위한 자력계 + 전자 반사계, 그리고 도플러 중력 실험. Boynton 팀의 중성자 자료 분석(Feldman et al., Science 281 + 284)은 달의 양극 모두에서 중성자 플럭스가 뚜렷하게 부족함을 발견했다 — 영구 음영 극지 크레이터에 수소가 풍부한 물질(아마도 물얼음) 약 2 × 10⁹ 톤이 있다는 것과 부합한다. 임무는 1999년 7월 31일 섀클턴 분화구 근처에 의도적으로 충돌하며 끝났는데, 탐지 가능한 수증기 기둥이 나오기를 기대했으나 관측되지 않았다. 이 수소 발견은 LCROSS와 Chandrayaan-1 / M3(2009)가 독립적으로 확인해 줄 때까지 유지되었다.",
  "events": [
    {
      "met": 0,
      "label": "발사",
      "note": "케이프 커내버럴 SLC-46에서 Athena II 로켓으로 1998년 1월 7일 02:28 UTC 발사.",
      "type": "nominal"
    },
    {
      "met": 0.07,
      "label": "TLI",
      "note": "달 이행 주입.",
      "type": "nominal"
    },
    {
      "met": 4.1,
      "label": "LOI",
      "note": "1998년 1월 11일 달 궤도 진입 — 초기 100 × 100 km 극궤도.",
      "type": "nominal"
    },
    {
      "met": 60,
      "label": "극점 수소",
      "note": "중성자 분광계가 달의 양 극점 위에서 뚜렷한 중성자 플럭스 감소를 감지 — 강한 수소 신호, 극지역 물얼음과 일치.",
      "type": "info"
    },
    {
      "met": 569,
      "label": "SHACKLETON 충돌",
      "note": "1999년 7월 31일 09:52 UTC Shackleton 분화구 근처 의도된 충돌. 지구에서 관측된 수증기 플럼 없음.",
      "type": "nominal"
    }
  ],
  "vehicle_stage": "Athena II 달 전이 킥 스테이지 (Star-37)"
}
