{
  "name": "嫦娥五号",
  "vehicle": "长征五号",
  "payload": "发射质量 8200 kg；带回样品 1.731 kg",
  "delta_v": "~5 km/s",
  "type": "SAMPLE RETURN · 已飞行",
  "first": "44年来首次月球采样返回（上一次是1976年的Luna 24）",
  "description": "嫦娥五号是自1976年苏联Luna 24以来首次从月球采样返回——相隔44年。其架构是：轨道器+着陆器+上升器+样品返回舱，一次发射全部送出。着陆器降落在吕姆克山，钻取并铲取了1.731 kg月壤，随后起飞，与轨道器交会对接（首次无人月球轨道交会对接），返回舱把样品带回地球。这些样品来自一个仅有20亿年历史的区域——比任何Apollo或Luna样品都年轻得多，改写了月球火山活动的模型。",
  "events": [
    {
      "met": 0,
      "label": "发射",
      "note": "长征五号从文昌发射。",
      "type": "nominal"
    },
    {
      "met": 5,
      "label": "MOI",
      "note": "进入环月轨道。",
      "type": "nominal"
    },
    {
      "met": 8,
      "label": "触地",
      "note": "着陆器降落至吕姆克山（风暴洋）2020-12-01",
      "type": "nominal"
    },
    {
      "met": 8.5,
      "label": "采样",
      "note": "通过铲取和钻探采集了1.731千克。",
      "type": "info"
    },
    {
      "met": 10,
      "label": "上升",
      "note": "上升器从月球表面升空。",
      "type": "nominal"
    },
    {
      "met": 13,
      "label": "交会",
      "note": "首次月球机器人交会对接；样品容器转移至轨道器。",
      "type": "info"
    },
    {
      "met": 23,
      "label": "返回地球",
      "note": "样品返回舱在内蒙古着陆 2020-12-16。",
      "type": "info"
    }
  ],
  "vehicle_stage": "长征五号 YZ-1 上面级"
}
