{
  "name": "Cassini-Huygens",
  "vehicle": "Titan IVB / Centaur",
  "payload": "Орбитер Сатурна (~5712 kg сува маса) + спуштајућа сонда Huygens (~318 kg, изградила ESA, слетела на Титан 2005-01-14)",
  "delta_v": "~2 km/s (улазак у орбиту Сатурна)",
  "type": "Орбитер + Лендер · ОБАВЉЕНА",
  "first": "13 година у орбити око Сатурна — Huygens је слетео на Титан 2005-01-14 (прво меко слетање у спољашњем делу Сунчевог система)",
  "dispatch": "Cassini је учинила оно што ниједна летелица није учинила ни код једне џиновске планете: зауставила се. Тринаест година је боравила крај Сатурна, а најважнија открића дошла су управо од тог останка — гејзири Енцелада, ухваћени зато што је орбитер летео довољно близу и довољно често да угледа сићушни месец како свој скривени океан избацује у свемир. Спустила је европску сонду Huygens на Титан, једино слетање икад изведено у спољашњем делу Сунчевог система, и начинила карту света метанских река и језера. На крају, остала без горива, намерно је усмерена у Сатурн како никада не би пала на океанске месеце које је открила и загадила их — мисија која се завршила заштитом места која је открила.",
  "description": "Заједничка мисија NASA, ESA и ASI. Након седмогодишњег лета током којег је користила гравитационе праћке код Венере, Земље и Јупитера, Cassini је ушла у орбиту око Сатурна 2004-07-01 и радила 13 година, обавивши 294 орбите и 162 блиска прелета поред месечевих тела. Открила је плумове на јужном полу Енцелада (активне гејзире воденог леда), радаром приказала метанска језера на Титану и разазнала шестоугаону поларну олују на Сатурну. Велики финале (април–септембар 2017) провукао је 22 орбите кроз процеп између прстенова и врхова облака, а завршио се контролисаним уласком у атмосферу како би се отклонила свака могућност да Енцелад или Титан буду контаминирани земаљским микробима.",
  "events": [
    {
      "met": 0,
      "label": "ЛАНСИРАЊЕ",
      "note": "Titan IVB / Centaur уздиже спојени склоп Cassini-Huygens.",
      "type": "nominal"
    },
    {
      "met": 193,
      "label": "ГРАВИТАЦИОНА ПРАЋКА ВЕНЕРЕ",
      "note": "Прва од четири гравитационе праћке које скупљају енергију потребну за долазак до Сатурна.",
      "type": "nominal"
    },
    {
      "met": 2451,
      "label": "УЛАЗАК У ОРБИТУ ОКО САТУРНА",
      "note": "Паљење главног мотора убацује Cassini у орбиту око Сатурна и започиње тринаестогодишњу турнеју.",
      "type": "nominal"
    }
  ],
  "vehicle_stage": "горњи степен Centaur"
}
