{
  "name": "Mangalyaan",
  "vehicle": "PSLV-XL (C25)",
  "payload": "1337 kg",
  "delta_v": "~3.5 km/s",
  "type": "궤도선 · 비행 완료",
  "first": "아시아 최초의 화성 임무; 첫 시도에서 성공한 최초의 화성 임무",
  "description": "ISRO의 Mars Orbiter Mission은 개발 비용이 7,400만 달러였습니다 — 영화 Gravity의 제작비($1억)보다 적고, 이틀 먼저 도착한 NASA의 MAVEN($6억 7,100만)에 비하면 극히 일부였습니다. 18개월 만에 기술 시연용으로 제작된 Mangalyaan은 화성 전이 궤도 진입, 심우주 항법, 화성 궤도 진입, 그리고 8년간의 과학 관측까지 모든 목표를 달성했습니다. 인도는 화성에 도달한 네 번째 우주 기관이자 첫 시도에서 성공한 최초의 기관이 되었습니다.",
  "events": [
    {
      "met": 0,
      "label": "발사",
      "note": "스리하리코타에서 발사된 PSLV-XL (C25) — 상대적으로 작은 발사체로 궤도 상승 루프가 필요했다.",
      "type": "nominal"
    },
    {
      "met": 7,
      "label": "근지점 소각 1",
      "note": "화성 궤도 전이 이전 6번의 지구 궤도 상승 소각 중 첫 번째.",
      "type": "nominal"
    },
    {
      "met": 30,
      "label": "화성 궤도 전이 분사",
      "note": "최종 근지점 소각으로 우주선을 화성행 궤적에 올림.",
      "type": "nominal"
    },
    {
      "met": 324,
      "label": "화성 궤도 진입",
      "note": "Liquid Apogee Motor가 약 10개월의 휴면 후 발화 — 24분간 분사하여 궤도에 포획.",
      "type": "nominal"
    },
    {
      "met": 3300,
      "label": "미션 종료",
      "note": "우주선 추진제 고갈 후 2022년 4월에 교신 두절.",
      "type": "warning"
    }
  ],
  "vehicle_stage": "PSLV 4단 PS4"
}
