{
  "name": "Apollo 10",
  "vehicle": "Saturn V (AS-505)",
  "payload": "42775 kg प्रक्षेपित (CSM Charlie Brown (CSM-106) + LM Snoopy (LM-4))",
  "delta_v": "~6 km/s (आना-जाना)",
  "dispatch": "Apollo 10 ने पूरी लैंडिंग की उड़ान भरी — अंतिम पंद्रह किलोमीटर तक — और फिर योजना के अनुसार लौट पड़ा। स्टैफ़र्ड और सर्नन Lunar Module को शांति सागर में सतह के बिल्कुल पास तक ले गए, अवरोहण का हर चरण पूरा किया, और बिना उतरे वापस कक्षा में चढ़ गए। NASA ने आरोहण टैंक जान-बूझकर आधे खाली रखे, ताकि कितना भी लुभावना क्षण आए, उतरने का विकल्प कभी बचे ही नहीं। यह कार्यक्रम की सबसे कम सराही गई उड़ान है और सबसे अनुशासित उड़ानों में से एक: उन दो लोगों का पूरी गति का पूर्वाभ्यास, जो ढाई लाख मील उड़कर गए यह जानते हुए कि लैंडिंग किसी और के हिस्से आएगी।",
  "type": "मानवयुक्त चंद्र-कक्षा · उड़ान पूर्ण",
  "first": "चंद्र-लैंडिंग का पूर्ण ड्रेस रिहर्सल — LM ~15.6 किमी की ऊँचाई तक उतरा",
  "description": "पहली चंद्र लैंडिंग का पूर्ण ड्रेस रिहर्सल। स्टैफ़र्ड और सर्नन ने LM Snoopy को शांति सागर में Apollo 11 के नियोजित लैंडिंग स्थल के ऊपर ~15.6 किमी की ऊँचाई तक उतारा — वास्तविक लैंडिंग को छोड़कर लैंडिंग-अभिगमन का हर चरण। उन्होंने उस अवरोहण प्रोफ़ाइल, लैंडिंग रडार, आरोहण प्रक्षेपवक्र और मिलन प्रक्रिया की पुष्टि की जिसका उपयोग Apollo 11 दो महीने बाद करेगा। LM के आरोहण-चरण के प्रणोदक टैंकों में जान-बूझकर कम ईंधन भरा गया था (सामान्य मात्रा का ~50 %), ताकि लैंडिंग की कोशिश का कोई प्रलोभन न रहे। Snoopy का आरोहण चरण धनात्मक ∆v के साथ चंद्र कक्षा छोड़ने वाला अकेला था — उसे सूर्य-केंद्रित कक्षा में छोड़ दिया गया, जहाँ वह आज भी है और शौकिया खगोलविद उसे बीच-बीच में फिर खोज लेते हैं (सबसे हाल की पुष्टि Nick Howes / Faulkes Telescope ने 2019 में की)।",
  "events": [
    {
      "met": 0,
      "label": "प्रक्षेपण",
      "note": "Saturn V (AS-505) कैनेडी स्पेस सेंटर LC-39B से 1969-05-18 16:49 UTC — LC-39B से पहली मानवयुक्त प्रक्षेपण।",
      "type": "nominal"
    },
    {
      "met": 0.12,
      "label": "TLI",
      "note": "ट्रांस-लूनर इंजेक्शन। S-IVB ∆v ~3.05 km/s।",
      "type": "nominal"
    },
    {
      "met": 3.16,
      "label": "LOI",
      "note": "चंद्र कक्षा प्रवेश। SPS ∆v ~0.91 km/s।",
      "type": "nominal"
    },
    {
      "met": 4.6,
      "label": "LM पृथक्करण",
      "note": "Snoopy Charlie Brown से अलग होता है। दो-सदस्यीय दल (स्टैफ़र्ड + सर्नन) शांति सागर की ओर उतरता है।",
      "type": "nominal"
    },
    {
      "met": 4.66,
      "label": "निकटतम पहुँच",
      "note": "Snoopy Apollo 11 लक्ष्य स्थल के ऊपर ~15.6 किमी तक पहुंचता है — कोई लैंडिंग नहीं; टचडाउन को छोड़कर सब कुछ सत्यापित।",
      "type": "info"
    },
    {
      "met": 4.76,
      "label": "आरोहण + मिलन",
      "note": "Snoopy आरोहण चरण Charlie Brown के साथ पुनर्मिलन — चंद्र कक्षा में पहला पूर्ण LM-से-CSM पुनः डॉकिंग।",
      "type": "nominal"
    },
    {
      "met": 5.96,
      "label": "TEI",
      "note": "पृथ्वी-अभिमुख प्रक्षेपण। SPS ∆v ~1.0 km/s।",
      "type": "nominal"
    },
    {
      "met": 8.05,
      "label": "समुद्र में अवतरण",
      "note": "CM 1969-05-26 16:52 UTC को दक्षिण प्रशांत महासागर में जल में गिरा। USS Princeton द्वारा पुनरुद्धार।",
      "type": "nominal"
    }
  ]
}
