{
  "name": "Phoenix",
  "vehicle": "Delta II 7925-9.5",
  "payload": "670 kg Startmasse (350 kg Landemasse)",
  "delta_v": "~5,7 km/s",
  "type": "LANDER · GEFLOGEN",
  "first": "Erste Bestätigung von Wassereis im arktischen Regolith des Mars; erste weiche Triebwerkslandung auf dem Mars seit Viking 2",
  "description": "Phoenix wurde aus dem abgesagten Mars Surveyor 2001-Programm gerettet — Flughardware, die sechs Jahre lang gelagert worden war, wurde wieder zusammengebaut und auf die nördlichen Polarebenen des Mars ausgerichtet. Der Name wurde wörtlich gewählt. Landung am 2008-05-25 bei 68,22°N, 234,25°E auf Vastitas Borealis, weiter nördlich als jede vorherige Oberflächenmission. Innerhalb weniger Tage kratzte der Roboterarm durch den Mutterboden und legte strahlend weißes Eis frei, das über vier Sols sichtbar auf der Kamera sublimierte — direkter Nachweis von unterirdischem Wassereis in der Mars-Arktis. Entdeckte Perchlorate im Regolith und beobachtete Schneefall aus Wolken. Mission endete am 2008-11-02, als die Solarenergie unter die Betriebsschwelle fiel mit Beginn des Marswinters; es wurde nie erwartet, dass der Lander die Polarnacht überleben würde.",
  "events": [
    {
      "met": 0,
      "label": "START",
      "note": "Delta II 7925-9.5 von Cape Canaveral LC-17A.",
      "type": "nominal"
    },
    {
      "met": 7,
      "label": "TCM-1",
      "note": "Erste Bahnkorrektur.",
      "type": "nominal"
    },
    {
      "met": 294,
      "label": "TCM-6",
      "note": "Letzte Feinkorrektur vor EDL, 21 Stunden vor Eintritt.",
      "type": "nominal"
    },
    {
      "met": 295,
      "label": "EDL",
      "note": "Hitzeschild, Überschall-Fallschirm, zwölf Hydrazin-Bremstriebwerke — Triebwerksabstieg nach Viking-Art.",
      "type": "info"
    },
    {
      "met": 295.01,
      "label": "AUFSETZEN",
      "note": "Weiche Landung bei 68,22°N, 234,25°E — nördlichste Mars-Oberflächenmission.",
      "type": "info"
    },
    {
      "met": 302,
      "label": "EIS FREIGELEGT",
      "note": "Arm kratzt durch Mutterboden. Strahlend weißes Eis sublimiert über 4 Sols auf der Kamera.",
      "type": "info"
    },
    {
      "met": 458,
      "label": "MISSIONSENDE",
      "note": "2008-11-02. Mars-Winter; Solarenergie unter Betriebsschwelle.",
      "type": "warning"
    }
  ],
  "vehicle_stage": "Feststoff-Oberstufe Star 48B PAM-D"
}
