{
  "name": "MESSENGER",
  "vehicle": "Delta II 7925H-9.5",
  "payload": "Merkur-Orbiter; durch einen Sonnenschutz geschützt (Vorderseite 370 °C, Rückseite -45 °C); sieben Instrumente, darunter Bildgebung, Spektrometer, Magnetometer, Laserhöhenmesser",
  "delta_v": "~2,3 km/s (Merkur-Orbiteinschwung)",
  "type": "ORBITER · GEFLOGEN",
  "first": "Erste Raumsonde, die den Merkur umkreiste; erste vollständige Oberflächenkarte des innersten Planeten",
  "description": "MESSENGER (MErcury Surface, Space ENvironment, GEochemistry, and Ranging) nutzte sechs Swing-bys über sieben Jahre — Erde, Venus zweimal, Merkur dreimal — um am 2011-03-18 in die Merkurumlaufbahn zu verlangsamen. Mit Sonnenschutz ausgestattet, eine Seite bei 370 °C und die andere bei -45 °C. Entdeckungen umfassten Wassereis in permanent beschatteten Polkratern, zuvor unbekannte geologische Strukturen namens „Hollows\", und die Bestätigung, dass der Eisenkern des Merkur etwa 85 % des Planetenradius ausmacht (das größte Kern-zu-Radius-Verhältnis aller Planeten im Sonnensystem). Die Mission endete mit einem kontrollierten Einschlag auf die Merkuroberfläche am 2015-04-30, nachdem der Treibstoff aufgebraucht war.",
  "events": [
    {
      "met": 0,
      "label": "START",
      "note": "Delta II 7925H bringt MESSENGER auf eine Bahn mit sechs Vorbeiflugen.",
      "type": "nominal"
    },
    {
      "met": 365,
      "label": "SWING-BY ERDE",
      "note": "Erste von sechs Hilfen, um die Bahn ausreichend zu verlangsamen, um in die Merkurumlaufbahn zu gelangen.",
      "type": "nominal"
    },
    {
      "met": 2419,
      "label": "EINSCHWENKEN IN DIE MERKURUMLAUFBAHN",
      "note": "Haupttriebwerk-Brennphase platziert MESSENGER nach sieben Jahren Flugstrecke in die Merkurumlaufbahn.",
      "type": "nominal"
    }
  ]
}
