{
  "name": "Psyche",
  "vehicle": "Falcon Heavy",
  "payload": "2747 kg de masa de lanzamiento (1648 kg en seco; 1085 kg de propelente de xenón)",
  "delta_v": "~6,6 km/s",
  "type": "ORBITADOR · ACTIVO",
  "first": "Primera misión a un asteroide de clase M rico en metal; primer uso de propulsores iónicos de efecto Hall como propulsión principal de crucero",
  "description": "Psyche apunta hacia el núcleo de níquel-hierro expuesto de un protoplaneta diferenciado — un cuerpo metálico de 226 km que podría ser el análogo más cercano al núcleo de la Tierra accesible en el espacio. Lanzado 2023-10-13 en un Falcon Heavy desde Kennedy LC-39A. Cuatro propulsores iónicos de efecto Hall SPT-140 espiralizan la trayectoria hacia afuera; una asistencia gravitatoria de Marte en mayo de 2026 (4609 km de máxima aproximación) aportó la energía que el impulso iónico solo no podría entregar a tiempo. Llegada prevista 2029-08, seguida de un descenso de 26 meses en cuatro fases de órbita (A → B → C → D) cartografiando la gravedad, magnetismo, topografía y composición del asteroide. Si la hipótesis del núcleo metálico es correcta, Psyche se verá diferente a cualquier otro lugar que hayamos visitado — superficie de metal desnudo, depósitos de sulfuro de hierro, nada del caos de escombros típico de los asteroides.",
  "events": [
    {
      "met": 0,
      "label": "LANZAMIENTO",
      "note": "Falcon Heavy desde Kennedy LC-39A.",
      "type": "nominal"
    },
    {
      "met": 30,
      "label": "COMIENZO DE CRUCERO IÓNICO",
      "note": "Cuatro propulsores iónicos de efecto Hall toman el relevo. Aceleración continua de bajo empuje durante 4+ años.",
      "type": "info"
    },
    {
      "met": 945,
      "label": "ASISTENCIA GRAVITATORIA DE MARTE",
      "note": "2026-05-15. Máxima aproximación 4609 km — sobrevuelo de Marte completado.",
      "type": "info"
    },
    {
      "met": 2118,
      "label": "LLEGADA A PSYCHE",
      "note": "Captura gravitatoria por propulsión iónica en órbita de 700 km. Misión de 26 meses, cuatro fases orbitales.",
      "type": "info"
    }
  ],
  "vehicle_stage": "segunda etapa del Falcon Heavy"
}
