{
  "name": "Apollo 1 (AS-204)",
  "vehicle": "Saturn IB (AS-204) — nooit gelanceerd",
  "payload": "Apollo CSM-012 (Block I) — op het lanceerplatform uitgebrand",
  "delta_v": "0 km/s (missie geannuleerd vóór de vlucht)",
  "type": "BEMANDE AARDBAAN · GEANNULEERD",
  "first": "Dodelijke brand op het lanceerplatform vóór de lancering op 1967-01-27 doodde Grissom + White + Chaffee",
  "description": "Apollo 1 was de geplande eerste bemande vlucht van de Apollo Block I CSM, oorspronkelijk aangeduid als AS-204 en gepland voor lancering op 21-02-1967 vanaf LC-34. Tijdens een routinematige 'plugs-out'-test op 27-01-1967 om 17:31 EST, met de bemanning opgesloten in de onder druk staande cabine met zuivere zuurstof, ontstond een flitsbrand in de onderste apparatuurruimte — waarschijnlijk een vlamboog in een met Teflon geïsoleerde draad met verzilverd koper die tijdens de installatie was beschadigd. De cabinedruk schoot binnen 15 seconden naar 29 psi; het naar binnen openende luik kon niet worden geopend tegen het drukverschil in. Gus Grissom, Ed White en Roger Chaffee stierven binnen seconden door verstikking. Het onderzoek leidde tot een volledig herontwerp van Block I naar Block II + het veiligere naar buiten openende uniforme luik + niet-ontvlambare cabinematerialen + een stikstofrijke cabineatmosfeer vóór de lancering. De officiële aanduiding Apollo 1 werd postuum toegekend om de bemanning te eren. Latere Apollo-missies (CSM-101 t/m CSM-114) vlogen met de Block II-hardware die uit dit herontwerp voortkwam.",
  "events": [
    {
      "met": 0,
      "label": "BRAND OP HET PLATFORM",
      "note": "Plugs-out test 1967-01-27 17:31 EST. Flits in onder druk staande pure-O₂-cabine; druk in cabine liep op tot 29 psi in 15 s.",
      "type": "warning"
    },
    {
      "met": 1e-7,
      "label": "BEMANNING VERLOREN",
      "note": "Grissom + White + Chaffee sterven aan verstikking. Luke kon niet worden geopend tegen de drukverschil.",
      "type": "warning"
    },
    {
      "met": 25,
      "label": "PROGRAMMA STILGELEGD",
      "note": "Het bemande Apollo-programma 21 maanden stilgelegd. Missie postuum omgedoopt tot Apollo 1 uit eerbetoon.",
      "type": "info"
    }
  ]
}
