{
  "name": "Apollo 17",
  "vehicle": "Saturn V (AS-512)",
  "payload": "打上げ質量 48609 kg（CSM America + LM Challenger）",
  "delta_v": "~6 km/s（往復）",
  "dispatch": "Apollo 17は終わりだった。しかし1972年12月にそれを見ていたほぼ誰もがそうなるとは信じていなかった。これはまた、遅ればせながら、本物の科学者を月に送り込んだ飛行でもあった——地質学者ハリソン・シュミットは、ショーティ・クレーターでオレンジ色の火山ガラスを発見し、月が何でできているかを書き換えた。サーナンとシュミットは3日間滞在し、22マイルを走行した。そしてサーナンは、誰かが最後に登った梯子を昇り、「我々は来た時のままに去る。神の御心ならば、我々は戻るだろう」と述べた。半世紀以上が経った今も誰も戻っていない——そして月に戻るべきというあらゆる真剣な議論は、我々がかつてそれをできたという事実から始まるのである。",
  "type": "有人着陸機 · ローバー · 飛行済み",
  "first": "最後の有人月ミッション（訓練地質学者を乗せた唯一の Apollo）",
  "description": "人類が別世界を訪れた最後の機会——それはもう半世紀以上前のことだ。サーナンとシュミットは月面に75時間滞在し、LRVで35.7 km走行し、110.5 kgの試料を持ち帰った。シュミットは月を歩いた唯一の訓練を受けた科学者（地質学者）で、ショーティ・クレーターの橙色の火山ガラスをはじめとする彼の発見は、月の地質学を書き換えた。最後にはしごを登る前のサーナンの言葉：『私たちは来たときと同じように去る。神の御心ならば、また戻ってくる』。その約束を果たす役目は、いまやArtemis IVが担う。",
  "events": [
    {
      "met": 0,
      "label": "打ち上げ",
      "note": "サターン V（AS-512）が KSC LC-39A から 1972-12-07 — Apollo で唯一の夜間打ち上げ。",
      "type": "nominal"
    },
    {
      "met": 0.13,
      "label": "TLI",
      "note": "月移行軌道投入。",
      "type": "nominal"
    },
    {
      "met": 3.4,
      "label": "MOI",
      "note": "月軌道投入。",
      "type": "nominal"
    },
    {
      "met": 4.6,
      "label": "接地",
      "note": "月着陸船 Challenger がタウルス・リトロー谷に着陸 1972-12-11 19:54 UTC。",
      "type": "nominal"
    },
    {
      "met": 4.76,
      "label": "最初の船外活動",
      "note": "サーナンとシュミットが最初の月面EVA開始（三期で計二十二時間四分）。",
      "type": "info"
    },
    {
      "met": 7.8,
      "label": "上昇",
      "note": "サーナン：『私たちは来たときと同じように去る。神の御心ならば、また戻ってくる』",
      "type": "nominal"
    },
    {
      "met": 12.6,
      "label": "着水",
      "note": "CM Americaが乗組員を太平洋に帰還 1972-12-19。",
      "type": "nominal"
    }
  ],
  "vehicle_stage": "Saturn V S-IVB（第3段）"
}
