{
  "name": "OSIRIS-REx",
  "vehicle": "Atlas V 411",
  "payload": "2110 kg de massa de lançamento (1075 kg a seco)",
  "delta_v": "~1,4 km/s",
  "type": "RETORNO DE AMOSTRA · REALIZADO",
  "first": "Maior amostra de asteroide já retornada (121,6 g de Bennu, entregue na Terra em 2023-09-24)",
  "description": "OSIRIS-REx realizou uma das operações de proximidade com asteroide mais precisas jamais tentadas. Lançado em 2016-09-08 de Cabo Canaveral em um Atlas V 411, utilizou uma assistência gravitacional terrestre em 2017 para rotacionar seu plano orbital até a inclinação de 6° de Bennu, e realizou o encontro com o asteroide carbonáceo próximo à Terra 2018-12-03, com 492 m de diâmetro. Após manutenção de estação a ~19 km, posteriormente entrou em uma órbita recorde de ~1,4 km — a órbita de espaçonave mais próxima jamais alcançada ao redor de qualquer corpo celeste. Passou dois anos mapeando a superfície repleta de boulders de Bennu e descobrindo ejeções ativas de partículas. Em 2020-10-20, o braço amostrador Touch-and-Go desceu até o sítio Nightingale, disparou gás N₂ na superfície e capturou uma pluma — penetrando 50 cm em uma superfície de \"fluido de pilha de entulho\". A Cápsula de Retorno de Amostra entregou 121,6 g de material de Bennu em Utah em 2023-09-24. A espaçonave em si foi imediatamente redesignada OSIRIS-APEX, em rota para um encontro com Apófis em 2029.",
  "events": [
    {
      "met": 0,
      "label": "LANÇAMENTO",
      "note": "Atlas V 411 de Cabo Canaveral SLC-41.",
      "type": "nominal"
    },
    {
      "met": 380,
      "label": "ASSISTÊNCIA GRAVITACIONAL TERRESTRE",
      "note": "2017-09-22, 17.237 km sobre a Antártida — rotaciona o plano orbital até a inclinação de 6° de Bennu.",
      "type": "info"
    },
    {
      "met": 816,
      "label": "ENCONTRO COM BENNU",
      "note": "Chega a Bennu; mantém posição a ~19 km e depois se aproxima progressivamente até uma órbita recorde de ~1,4 km — a órbita de espaçonave mais próxima já feita ao redor de qualquer corpo celeste.",
      "type": "info"
    },
    {
      "met": 1503,
      "label": "COLETA DE AMOSTRA TAG",
      "note": "2020-10-20. Braço Touch-and-Go penetra 50 cm na superfície de pilha de entulho; captura 121,6 g.",
      "type": "info"
    },
    {
      "met": 1705,
      "label": "PARTIDA DE BENNU",
      "note": "2021-05-10. Cruzeiro de retorno para a Terra de 2,5 anos.",
      "type": "nominal"
    },
    {
      "met": 2572,
      "label": "RETORNO DE AMOSTRA",
      "note": "2023-09-24. SRC desce de paraquedas no Utah Test and Training Range; espaçonave passa a ser OSIRIS-APEX.",
      "type": "info"
    }
  ],
  "vehicle_stage": "estágio superior Centaur (Atlas V 411)"
}
